Handle,Title,Body (HTML),Vendor,Product Category,Type,Tags,Published,Option1 Name,Option1 Value,Variant SKU,Variant Grams,Variant Inventory Tracker,Variant Inventory Qty,Variant Inventory Policy,Variant Fulfillment Service,Variant Price,Variant Compare At Price,Variant Requires Shipping,Variant Taxable,Image Src,Image Position,Image Alt Text,SEO Title,SEO Description,Status
b01-voyageur-meraude,Voyageur Émeraude,Travel bag in emerald leather with cognac matelassé details. A piece for those who know how to arrive.,Le Chic Femme,,Bags,"weekender, cuir, voyage",TRUE,Title,Default Title,B01,0,shopify,50,continue,manual,489.00,,TRUE,TRUE,https://raw.githubusercontent.com/Jav-12-mtz/le-chic-femme-hydrogen/main/public/images-webp/01_bolsos/B01_Voyageur-%C3%89meraude.webp,1,Voyageur Émeraude,Voyageur Émeraude - Le Chic Femme,Travel bag in emerald leather with cognac matelassé details. A piece for those who know how to arrive.,active
b02-saphir-mini-chain,Saphir Mini Chain,Sapphire mini bag with silver chain. Compact audacity for nights of light.,Le Chic Femme,,Bags,"mini, cadena, azul",TRUE,Title,Default Title,B02,0,shopify,50,continue,manual,279.00,,TRUE,TRUE,https://raw.githubusercontent.com/Jav-12-mtz/le-chic-femme-hydrogen/main/public/images-webp/01_bolsos/B02_Saphir-Mini-Chain.webp,1,Saphir Mini Chain,Saphir Mini Chain - Le Chic Femme,Sapphire mini bag with silver chain. Compact audacity for nights of light.,active
b03-madame-corail,Madame Corail,Structured top-handle in coral leather with silver clasp. A statement piece.,Le Chic Femme,,Bags,"top-handle, corail, statement",TRUE,Title,Default Title,B03,0,shopify,50,continue,manual,529.00,,TRUE,TRUE,https://raw.githubusercontent.com/Jav-12-mtz/le-chic-femme-hydrogen/main/public/images-webp/01_bolsos/B03_Madame-Corail.webp,1,Madame Corail,Madame Corail - Le Chic Femme,Structured top-handle in coral leather with silver clasp. A statement piece.,active
b04-petite-rose-quilted,Petite Rose Quilted,Dusty rose quilted with golden hardware on marble. Femininity made object.,Le Chic Femme,,Bags,"quilted, rose, crossbody",TRUE,Title,Default Title,B04,0,shopify,50,continue,manual,319.00,,TRUE,TRUE,https://raw.githubusercontent.com/Jav-12-mtz/le-chic-femme-hydrogen/main/public/images-webp/01_bolsos/B04_Petite-Rose-Quilted.webp,1,Petite Rose Quilted,Petite Rose Quilted - Le Chic Femme,Dusty rose quilted with golden hardware on marble. Femininity made object.,active
b05--meraude-mini-lock,Émeraude Mini Lock,Emerald bag with golden lock closure. A jewel to wear.,Le Chic Femme,,Bags,"mini, émeraude, lock",TRUE,Title,Default Title,B05,0,shopify,50,continue,manual,299.00,,TRUE,TRUE,https://raw.githubusercontent.com/Jav-12-mtz/le-chic-femme-hydrogen/main/public/images-webp/01_bolsos/B05_%C3%89meraude-Mini-Lock.webp,1,Émeraude Mini Lock,Émeraude Mini Lock - Le Chic Femme,Emerald bag with golden lock closure. A jewel to wear.,active
b06-trame-noire,Trame Noire,"Woven shoulder bag in black and cream. Artisanal weave, Parisian soul.",Le Chic Femme,,Bags,"woven, shoulder, noir",TRUE,Title,Default Title,B06,0,shopify,50,continue,manual,249.00,,TRUE,TRUE,https://raw.githubusercontent.com/Jav-12-mtz/le-chic-femme-hydrogen/main/public/images-webp/01_bolsos/B06_Trame-Noire.webp,1,Trame Noire,Trame Noire - Le Chic Femme,"Woven shoulder bag in black and cream. Artisanal weave, Parisian soul.",active
b07-cuir-cognac-xl,Cuir Cognac XL,Oversize tote in braided cognac leather with golden chain. Everyday luxury.,Le Chic Femme,,Bags,"tote, cognac, oversized",TRUE,Title,Default Title,B07,0,shopify,50,continue,manual,599.00,,TRUE,TRUE,https://raw.githubusercontent.com/Jav-12-mtz/le-chic-femme-hydrogen/main/public/images-webp/01_bolsos/B07_Cuir-Cognac-XL.webp,1,Cuir Cognac XL,Cuir Cognac XL - Le Chic Femme,Oversize tote in braided cognac leather with golden chain. Everyday luxury.,active
b08-atlas-cuir-voyage,Atlas Cuir Voyage,"Tobacco leather weekender, cinematic lighting. The journey begins here.",Le Chic Femme,,Bags,"weekender, cuir, tabac",TRUE,Title,Default Title,B08,0,shopify,50,continue,manual,749.00,,TRUE,TRUE,https://raw.githubusercontent.com/Jav-12-mtz/le-chic-femme-hydrogen/main/public/images-webp/01_bolsos/B08_Atlas-Cuir-Voyage.webp,1,Atlas Cuir Voyage,Atlas Cuir Voyage - Le Chic Femme,"Tobacco leather weekender, cinematic lighting. The journey begins here.",active
b09-noir-tote-parisien,Noir Tote Parisien,Black tote with structured handles. The silent elegance of minimalism.,Le Chic Femme,,Bags,"tote, noir, minimalista",TRUE,Title,Default Title,B09,0,shopify,50,continue,manual,429.00,,TRUE,TRUE,https://raw.githubusercontent.com/Jav-12-mtz/le-chic-femme-hydrogen/main/public/images-webp/01_bolsos/B09_Noir-Tote-Parisien.webp,1,Noir Tote Parisien,Noir Tote Parisien - Le Chic Femme,Black tote with structured handles. The silent elegance of minimalism.,active
b10-monogramme-beige,Monogramme Beige,Beige hobo with timeless monogram. Heritage redefined.,Le Chic Femme,,Bags,"hobo, monogramme, beige",TRUE,Title,Default Title,B10,0,shopify,50,continue,manual,649.00,,TRUE,TRUE,https://raw.githubusercontent.com/Jav-12-mtz/le-chic-femme-hydrogen/main/public/images-webp/01_bolsos/B10_Monogramme-Beige.webp,1,Monogramme Beige,Monogramme Beige - Le Chic Femme,Beige hobo with timeless monogram. Heritage redefined.,active
b11-rouge-passion-chain,Rouge Passion Chain,Quilted red envelope with rose gold chain. Pure French passion.,Le Chic Femme,,Bags,"envelope, rouge, chain",TRUE,Title,Default Title,B11,0,shopify,50,continue,manual,589.00,,TRUE,TRUE,https://raw.githubusercontent.com/Jav-12-mtz/le-chic-femme-hydrogen/main/public/images-webp/01_bolsos/B11_Rouge-Passion-Chain.webp,1,Rouge Passion Chain,Rouge Passion Chain - Le Chic Femme,Quilted red envelope with rose gold chain. Pure French passion.,active
b12-rose-croco-mini,Rose Croco Mini,Mini bag with pink croco embossing. A daytime statement.,Le Chic Femme,,Bags,"mini, croco, rose",TRUE,Title,Default Title,B12,0,shopify,50,continue,manual,349.00,,TRUE,TRUE,https://raw.githubusercontent.com/Jav-12-mtz/le-chic-femme-hydrogen/main/public/images-webp/01_bolsos/B12_Rose-Croco-Mini.webp,1,Rose Croco Mini,Rose Croco Mini - Le Chic Femme,Mini bag with pink croco embossing. A daytime statement.,active
b13-noir-ciel-crossbody,Noir Ciel Crossbody,Black crossbody with silver chain and medallion charm. Quiet character.,Le Chic Femme,,Bags,"crossbody, noir, cadena",TRUE,Title,Default Title,B13,0,shopify,50,continue,manual,289.00,,TRUE,TRUE,https://raw.githubusercontent.com/Jav-12-mtz/le-chic-femme-hydrogen/main/public/images-webp/01_bolsos/B13_Noir-Ciel-Crossbody.webp,1,Noir Ciel Crossbody,Noir Ciel Crossbody - Le Chic Femme,Black crossbody with silver chain and medallion charm. Quiet character.,active
b14-gris-perle-cartable,Gris Perle Cartable,Pearl gray satchel with golden buckles. The new office chic.,Le Chic Femme,,Bags,"satchel, gris, oficina",TRUE,Title,Default Title,B14,0,shopify,50,continue,manual,239.00,,TRUE,TRUE,https://raw.githubusercontent.com/Jav-12-mtz/le-chic-femme-hydrogen/main/public/images-webp/01_bolsos/B14_Gris-Perle-Cartable.webp,1,Gris Perle Cartable,Gris Perle Cartable - Le Chic Femme,Pearl gray satchel with golden buckles. The new office chic.,active
b15-duo-menthe-nude,Duo Menthe Nude,Duo set: mint shoulder + nude crossbody. Collectible.,Le Chic Femme,,Bags,"duo, menthe, nude",TRUE,Title,Default Title,B15,0,shopify,50,continue,manual,469.00,,TRUE,TRUE,https://raw.githubusercontent.com/Jav-12-mtz/le-chic-femme-hydrogen/main/public/images-webp/01_bolsos/B15_Duo-Menthe-Nude.webp,1,Duo Menthe Nude,Duo Menthe Nude - Le Chic Femme,Duo set: mint shoulder + nude crossbody. Collectible.,active
b16-sage-garden-mini,Sage Garden Mini,"Textured sage mini, ideal for garden strolls.",Le Chic Femme,,Bags,"mini, sage, garden",TRUE,Title,Default Title,B16,0,shopify,50,continue,manual,259.00,,TRUE,TRUE,https://raw.githubusercontent.com/Jav-12-mtz/le-chic-femme-hydrogen/main/public/images-webp/01_bolsos/B16_Sage-Garden-Mini.webp,1,Sage Garden Mini,Sage Garden Mini - Le Chic Femme,"Textured sage mini, ideal for garden strolls.",active
b17--carlate-royal,Écarlate Royal,Scarlet top-handle in polished leather with silver clasp. Modern royalty.,Le Chic Femme,,Bags,"top-handle, rouge, luxe",TRUE,Title,Default Title,B17,0,shopify,50,continue,manual,799.00,,TRUE,TRUE,https://raw.githubusercontent.com/Jav-12-mtz/le-chic-femme-hydrogen/main/public/images-webp/01_bolsos/B17_%C3%89carlate-Royal.webp,1,Écarlate Royal,Écarlate Royal - Le Chic Femme,Scarlet top-handle in polished leather with silver clasp. Modern royalty.,active
b18-trois-couleurs-buckle,Trois Couleurs Buckle,Satchel with cream-black-red-cognac stripes and golden buckles. Tricolor signature.,Le Chic Femme,,Bags,"satchel, multi, buckle",TRUE,Title,Default Title,B18,0,shopify,50,continue,manual,539.00,,TRUE,TRUE,https://raw.githubusercontent.com/Jav-12-mtz/le-chic-femme-hydrogen/main/public/images-webp/01_bolsos/B18_Trois-Couleurs-Buckle.webp,1,Trois Couleurs Buckle,Trois Couleurs Buckle - Le Chic Femme,Satchel with cream-black-red-cognac stripes and golden buckles. Tricolor signature.,active
z01-talon-myst-re,Talon Mystère,Editorial heel for the woman who walks with purpose.,Le Chic Femme,,Shoes,"heel, editorial",TRUE,Title,Default Title,Z01,0,shopify,50,continue,manual,129.00,,TRUE,TRUE,https://raw.githubusercontent.com/Jav-12-mtz/le-chic-femme-hydrogen/main/public/images-webp/04_zapatos/Z01_Talon-Myst%C3%A8re.webp,1,Talon Mystère,Talon Mystère - Le Chic Femme,Editorial heel for the woman who walks with purpose.,active
z02-pointe-cognac-crois,Pointe Cognac Croisé,Pointed-toe cognac with crossed ankle straps.,Le Chic Femme,,Shoes,"pointed, cognac, strappy",TRUE,Title,Default Title,Z02,0,shopify,50,continue,manual,119.00,,TRUE,TRUE,https://raw.githubusercontent.com/Jav-12-mtz/le-chic-femme-hydrogen/main/public/images-webp/04_zapatos/Z02_Pointe-Cognac-Crois%C3%A9.webp,1,Pointe Cognac Croisé,Pointe Cognac Croisé - Le Chic Femme,Pointed-toe cognac with crossed ankle straps.,active
z03-sandale-sunlight,Sandale Sunlight,Summer sandal for sunlit afternoons.,Le Chic Femme,,Shoes,"sandal, summer",TRUE,Title,Default Title,Z03,0,shopify,50,continue,manual,89.00,,TRUE,TRUE,https://raw.githubusercontent.com/Jav-12-mtz/le-chic-femme-hydrogen/main/public/images-webp/04_zapatos/Z03_Sandale-Sunlight.webp,1,Sandale Sunlight,Sandale Sunlight - Le Chic Femme,Summer sandal for sunlit afternoons.,active
z04-voile-mari-e-camel,Voile Mariée Camel,Camel suede stiletto with ankle straps.,Le Chic Femme,,Shoes,"bridal, camel, heel",TRUE,Title,Default Title,Z04,0,shopify,50,continue,manual,149.00,,TRUE,TRUE,https://raw.githubusercontent.com/Jav-12-mtz/le-chic-femme-hydrogen/main/public/images-webp/04_zapatos/Z04_Voile-Mari%C3%A9e-Camel.webp,1,Voile Mariée Camel,Voile Mariée Camel - Le Chic Femme,Camel suede stiletto with ankle straps.,active
z05-talon-couture-studio,Talon Couture Studio,Studio-shot couture heel. Pure form.,Le Chic Femme,,Shoes,"heel, studio",TRUE,Title,Default Title,Z05,0,shopify,50,continue,manual,159.00,,TRUE,TRUE,https://raw.githubusercontent.com/Jav-12-mtz/le-chic-femme-hydrogen/main/public/images-webp/04_zapatos/Z05_Talon-Couture-Studio.webp,1,Talon Couture Studio,Talon Couture Studio - Le Chic Femme,Studio-shot couture heel. Pure form.,active
z06-burgundy-velours-stiletto,Burgundy Velours Stiletto,Burgundy velvet stiletto with ankle strap.,Le Chic Femme,,Shoes,"stiletto, burgundy, velour",TRUE,Title,Default Title,Z06,0,shopify,50,continue,manual,179.00,,TRUE,TRUE,https://raw.githubusercontent.com/Jav-12-mtz/le-chic-femme-hydrogen/main/public/images-webp/04_zapatos/Z06_Burgundy-Velours-Stiletto.webp,1,Burgundy Velours Stiletto,Burgundy Velours Stiletto - Le Chic Femme,Burgundy velvet stiletto with ankle strap.,active
z07-bordeaux-soir-e,Bordeaux Soirée,Evening heel in bordeaux. For nights that matter.,Le Chic Femme,,Shoes,"heel, bordeaux, soirée",TRUE,Title,Default Title,Z07,0,shopify,50,continue,manual,169.00,,TRUE,TRUE,https://raw.githubusercontent.com/Jav-12-mtz/le-chic-femme-hydrogen/main/public/images-webp/04_zapatos/Z07_Bordeaux-Soir%C3%A9e.webp,1,Bordeaux Soirée,Bordeaux Soirée - Le Chic Femme,Evening heel in bordeaux. For nights that matter.,active
z08-dentelle-blanche-mari-e,Dentelle Blanche Mariée,Ivory pointed heel in lace over satin.,Le Chic Femme,,Shoes,"bridal, lace, blanc",TRUE,Title,Default Title,Z08,0,shopify,50,continue,manual,199.00,,TRUE,TRUE,https://raw.githubusercontent.com/Jav-12-mtz/le-chic-femme-hydrogen/main/public/images-webp/04_zapatos/Z08_Dentelle-Blanche-Mari%C3%A9e.webp,1,Dentelle Blanche Mariée,Dentelle Blanche Mariée - Le Chic Femme,Ivory pointed heel in lace over satin.,active
z09-studded-ivoire-bloc,Studded Ivoire Bloc,Ivory block-heel sandal with studs.,Le Chic Femme,,Shoes,"studded, ivoire, block",TRUE,Title,Default Title,Z09,0,shopify,50,continue,manual,189.00,,TRUE,TRUE,https://raw.githubusercontent.com/Jav-12-mtz/le-chic-femme-hydrogen/main/public/images-webp/04_zapatos/Z09_Studded-Ivoire-Bloc.webp,1,Studded Ivoire Bloc,Studded Ivoire Bloc - Le Chic Femme,Ivory block-heel sandal with studs.,active
z10-bridal-suite-perles,Bridal Suite Perles,White square-heel sandal + pearl earrings. A bridal tale.,Le Chic Femme,,Shoes,"bridal, pearls, set",TRUE,Title,Default Title,Z10,0,shopify,50,continue,manual,249.00,,TRUE,TRUE,https://raw.githubusercontent.com/Jav-12-mtz/le-chic-femme-hydrogen/main/public/images-webp/04_zapatos/Z10_Bridal-Suite-Perles.webp,1,Bridal Suite Perles,Bridal Suite Perles - Le Chic Femme,White square-heel sandal + pearl earrings. A bridal tale.,active
z11-studio-l-gance,Studio Élégance,Studio elegance. Quiet sophistication.,Le Chic Femme,,Shoes,"heel, studio",TRUE,Title,Default Title,Z11,0,shopify,50,continue,manual,139.00,,TRUE,TRUE,https://raw.githubusercontent.com/Jav-12-mtz/le-chic-femme-hydrogen/main/public/images-webp/04_zapatos/Z11_Studio-%C3%89l%C3%A9gance.webp,1,Studio Élégance,Studio Élégance - Le Chic Femme,Studio elegance. Quiet sophistication.,active
z12-stiletto-myst-re,Stiletto Mystère,Mysterious stiletto. Editorial appeal.,Le Chic Femme,,Shoes,"stiletto, editorial",TRUE,Title,Default Title,Z12,0,shopify,50,continue,manual,169.00,,TRUE,TRUE,https://raw.githubusercontent.com/Jav-12-mtz/le-chic-femme-hydrogen/main/public/images-webp/04_zapatos/Z12_Stiletto-Myst%C3%A8re.webp,1,Stiletto Mystère,Stiletto Mystère - Le Chic Femme,Mysterious stiletto. Editorial appeal.,active
j01-bague-couronne,Bague Couronne,Gold crown ring. A small majesty.,Le Chic Femme,,Jewelry & Watches,"bague, or",TRUE,Title,Default Title,J01,0,shopify,50,continue,manual,189.00,,TRUE,TRUE,https://raw.githubusercontent.com/Jav-12-mtz/le-chic-femme-hydrogen/main/public/images-webp/03_joyas_relojes/J01_Bague-Couronne.webp,1,Bague Couronne,Bague Couronne - Le Chic Femme,Gold crown ring. A small majesty.,active
j02-bracelets-tress-s,Bracelets Tressés,Braided bracelets to stack.,Le Chic Femme,,Jewelry & Watches,"bracelet, tressé",TRUE,Title,Default Title,J02,0,shopify,50,continue,manual,149.00,,TRUE,TRUE,https://raw.githubusercontent.com/Jav-12-mtz/le-chic-femme-hydrogen/main/public/images-webp/03_joyas_relojes/J02_Bracelets-Tress%C3%A9s.webp,1,Bracelets Tressés,Bracelets Tressés - Le Chic Femme,Braided bracelets to stack.,active
j03-or-solitaire,Or Solitaire,Gold solitaire ring. Forever in mind.,Le Chic Femme,,Jewelry & Watches,"bague, solitaire",TRUE,Title,Default Title,J03,0,shopify,50,continue,manual,329.00,,TRUE,TRUE,https://raw.githubusercontent.com/Jav-12-mtz/le-chic-femme-hydrogen/main/public/images-webp/03_joyas_relojes/J03_Or-Solitaire.webp,1,Or Solitaire,Or Solitaire - Le Chic Femme,Gold solitaire ring. Forever in mind.,active
j04-boucles-or-hoops,Boucles Or Hoops,Golden hoops. The essential.,Le Chic Femme,,Jewelry & Watches,"boucles, hoops, or",TRUE,Title,Default Title,J04,0,shopify,50,continue,manual,219.00,,TRUE,TRUE,https://raw.githubusercontent.com/Jav-12-mtz/le-chic-femme-hydrogen/main/public/images-webp/03_joyas_relojes/J04_Boucles-Or-Hoops.webp,1,Boucles Or Hoops,Boucles Or Hoops - Le Chic Femme,Golden hoops. The essential.,active
j05-diamants-anneau,Diamants Anneau,Diamond eternity ring. Forever bright.,Le Chic Femme,,Jewelry & Watches,"bague, diamants",TRUE,Title,Default Title,J05,0,shopify,50,continue,manual,849.00,,TRUE,TRUE,https://raw.githubusercontent.com/Jav-12-mtz/le-chic-femme-hydrogen/main/public/images-webp/03_joyas_relojes/J05_Diamants-Anneau.webp,1,Diamants Anneau,Diamants Anneau - Le Chic Femme,Diamond eternity ring. Forever bright.,active
j06-or-anneau-mystique,Or Anneau Mystique,Mystical gold ring. Sculptural form.,Le Chic Femme,,Jewelry & Watches,"bague, or",TRUE,Title,Default Title,J06,0,shopify,50,continue,manual,369.00,,TRUE,TRUE,https://raw.githubusercontent.com/Jav-12-mtz/le-chic-femme-hydrogen/main/public/images-webp/03_joyas_relojes/J06_Or-Anneau-Mystique.webp,1,Or Anneau Mystique,Or Anneau Mystique - Le Chic Femme,Mystical gold ring. Sculptural form.,active
j07-pendentif-initiale,Pendentif Initiale,Gold initial pendant. Personal heirloom.,Le Chic Femme,,Jewelry & Watches,"pendentif, or",TRUE,Title,Default Title,J07,0,shopify,50,continue,manual,249.00,,TRUE,TRUE,https://raw.githubusercontent.com/Jav-12-mtz/le-chic-femme-hydrogen/main/public/images-webp/03_joyas_relojes/J07_Pendentif-Initiale.webp,1,Pendentif Initiale,Pendentif Initiale - Le Chic Femme,Gold initial pendant. Personal heirloom.,active
j08-montre-cadran-noir,Montre Cadran Noir,Black dial watch. Discreet excellence.,Le Chic Femme,,Jewelry & Watches,"montre, noir",TRUE,Title,Default Title,J08,0,shopify,50,continue,manual,789.00,,TRUE,TRUE,https://raw.githubusercontent.com/Jav-12-mtz/le-chic-femme-hydrogen/main/public/images-webp/03_joyas_relojes/J08_Montre-Cadran-Noir.webp,1,Montre Cadran Noir,Montre Cadran Noir - Le Chic Femme,Black dial watch. Discreet excellence.,active
j09-collier-d-licat,Collier Délicat,Delicate gold necklace. Whisper of luxury.,Le Chic Femme,,Jewelry & Watches,"collier, or",TRUE,Title,Default Title,J09,0,shopify,50,continue,manual,189.00,,TRUE,TRUE,https://raw.githubusercontent.com/Jav-12-mtz/le-chic-femme-hydrogen/main/public/images-webp/03_joyas_relojes/J09_Collier-D%C3%A9licat.webp,1,Collier Délicat,Collier Délicat - Le Chic Femme,Delicate gold necklace. Whisper of luxury.,active
j10-montre-or-l-gance,Montre Or Élégance,Elegant gold watch. Quietly powerful.,Le Chic Femme,,Jewelry & Watches,"montre, or",TRUE,Title,Default Title,J10,0,shopify,50,continue,manual,929.00,,TRUE,TRUE,https://raw.githubusercontent.com/Jav-12-mtz/le-chic-femme-hydrogen/main/public/images-webp/03_joyas_relojes/J10_Montre-Or-%C3%89l%C3%A9gance.webp,1,Montre Or Élégance,Montre Or Élégance - Le Chic Femme,Elegant gold watch. Quietly powerful.,active
j11-hoops-sculpture,Hoops Sculpture,Sculptural hoops. Wearable architecture.,Le Chic Femme,,Jewelry & Watches,"boucles, sculpture",TRUE,Title,Default Title,J11,0,shopify,50,continue,manual,199.00,,TRUE,TRUE,https://raw.githubusercontent.com/Jav-12-mtz/le-chic-femme-hydrogen/main/public/images-webp/03_joyas_relojes/J11_Hoops-Sculpture.webp,1,Hoops Sculpture,Hoops Sculpture - Le Chic Femme,Sculptural hoops. Wearable architecture.,active
j12-cha-ne-statement,Chaîne Statement,Statement chain necklace. Bold by design.,Le Chic Femme,,Jewelry & Watches,"collier, chaîne",TRUE,Title,Default Title,J12,0,shopify,50,continue,manual,389.00,,TRUE,TRUE,https://raw.githubusercontent.com/Jav-12-mtz/le-chic-femme-hydrogen/main/public/images-webp/03_joyas_relojes/J12_Cha%C3%AEne-Statement.webp,1,Chaîne Statement,Chaîne Statement - Le Chic Femme,Statement chain necklace. Bold by design.,active
j13-montre-squelette,Montre Squelette,Skeleton watch. The art of mechanics revealed.,Le Chic Femme,,Jewelry & Watches,"montre, squelette",TRUE,Title,Default Title,J13,0,shopify,50,continue,manual,1249.00,,TRUE,TRUE,https://raw.githubusercontent.com/Jav-12-mtz/le-chic-femme-hydrogen/main/public/images-webp/03_joyas_relojes/J13_Montre-Squelette.webp,1,Montre Squelette,Montre Squelette - Le Chic Femme,Skeleton watch. The art of mechanics revealed.,active
j14-montre-detail-cadran,Montre Detail Cadran,Watch with intricate dial details.,Le Chic Femme,,Jewelry & Watches,"montre, detail",TRUE,Title,Default Title,J14,0,shopify,50,continue,manual,989.00,,TRUE,TRUE,https://raw.githubusercontent.com/Jav-12-mtz/le-chic-femme-hydrogen/main/public/images-webp/03_joyas_relojes/J14_Montre-Detail-Cadran.webp,1,Montre Detail Cadran,Montre Detail Cadran - Le Chic Femme,Watch with intricate dial details.,active
j15-empilement-bagues,Empilement Bagues,Ring stack. Collected over time.,Le Chic Femme,,Jewelry & Watches,"bague, set",TRUE,Title,Default Title,J15,0,shopify,50,continue,manual,429.00,,TRUE,TRUE,https://raw.githubusercontent.com/Jav-12-mtz/le-chic-femme-hydrogen/main/public/images-webp/03_joyas_relojes/J15_Empilement-Bagues.webp,1,Empilement Bagues,Empilement Bagues - Le Chic Femme,Ring stack. Collected over time.,active
j16-boucles-vintage,Boucles Vintage,Vintage-inspired earrings. Timeless craft.,Le Chic Femme,,Jewelry & Watches,"boucles, vintage",TRUE,Title,Default Title,J16,0,shopify,50,continue,manual,169.00,,TRUE,TRUE,https://raw.githubusercontent.com/Jav-12-mtz/le-chic-femme-hydrogen/main/public/images-webp/03_joyas_relojes/J16_Boucles-Vintage.webp,1,Boucles Vintage,Boucles Vintage - Le Chic Femme,Vintage-inspired earrings. Timeless craft.,active
j17-or-d-tail-macro,Or Détail Macro,Macro view of pure gold. Detail obsessed.,Le Chic Femme,,Jewelry & Watches,"macro, or",TRUE,Title,Default Title,J17,0,shopify,50,continue,manual,289.00,,TRUE,TRUE,https://raw.githubusercontent.com/Jav-12-mtz/le-chic-femme-hydrogen/main/public/images-webp/03_joyas_relojes/J17_Or-D%C3%A9tail-Macro.webp,1,Or Détail Macro,Or Détail Macro - Le Chic Femme,Macro view of pure gold. Detail obsessed.,active
j18-or-multi-bagues,Or Multi Bagues,Multi-ring gold set.,Le Chic Femme,,Jewelry & Watches,"bague, set",TRUE,Title,Default Title,J18,0,shopify,50,continue,manual,389.00,,TRUE,TRUE,https://raw.githubusercontent.com/Jav-12-mtz/le-chic-femme-hydrogen/main/public/images-webp/03_joyas_relojes/J18_Or-Multi-Bagues.webp,1,Or Multi Bagues,Or Multi Bagues - Le Chic Femme,Multi-ring gold set.,active
j19-montre-meraude-cuir,Montre Émeraude Cuir,Square watch with emerald dial and black leather strap. Aristocratic discretion.,Le Chic Femme,,Jewelry & Watches,"montre, émeraude, cuir",TRUE,Title,Default Title,J19,0,shopify,50,continue,manual,899.00,,TRUE,TRUE,https://raw.githubusercontent.com/Jav-12-mtz/le-chic-femme-hydrogen/main/public/images-webp/03_joyas_relojes/J19_Montre-%C3%89meraude-Cuir.webp,1,Montre Émeraude Cuir,Montre Émeraude Cuir - Le Chic Femme,Square watch with emerald dial and black leather strap. Aristocratic discretion.,active
j20-montre-rose-gold-tweed,Montre Rose Gold Tweed,Rose gold watch with mother-of-pearl dial. A Parisian rendezvous.,Le Chic Femme,,Jewelry & Watches,"montre, rose-gold",TRUE,Title,Default Title,J20,0,shopify,50,continue,manual,869.00,,TRUE,TRUE,https://raw.githubusercontent.com/Jav-12-mtz/le-chic-femme-hydrogen/main/public/images-webp/03_joyas_relojes/J20_Montre-Rose-Gold-Tweed.webp,1,Montre Rose Gold Tweed,Montre Rose Gold Tweed - Le Chic Femme,Rose gold watch with mother-of-pearl dial. A Parisian rendezvous.,active
j21-montre-tableau-nacr,Montre Tableau Nacré,Mother-of-pearl dial watch. Iridescent grace.,Le Chic Femme,,Jewelry & Watches,"montre, nacré",TRUE,Title,Default Title,J21,0,shopify,50,continue,manual,749.00,,TRUE,TRUE,https://raw.githubusercontent.com/Jav-12-mtz/le-chic-femme-hydrogen/main/public/images-webp/03_joyas_relojes/J21_Montre-Tableau-Nacr%C3%A9.webp,1,Montre Tableau Nacré,Montre Tableau Nacré - Le Chic Femme,Mother-of-pearl dial watch. Iridescent grace.,active
j22-montre-bracelet-or,Montre Bracelet Or,Gold bracelet watch. Wrist couture.,Le Chic Femme,,Jewelry & Watches,"montre, or",TRUE,Title,Default Title,J22,0,shopify,50,continue,manual,969.00,,TRUE,TRUE,https://raw.githubusercontent.com/Jav-12-mtz/le-chic-femme-hydrogen/main/public/images-webp/03_joyas_relojes/J22_Montre-Bracelet-Or.webp,1,Montre Bracelet Or,Montre Bracelet Or - Le Chic Femme,Gold bracelet watch. Wrist couture.,active
j23-or-studio-lumi-re,Or Studio Lumière,Gold piece under studio light.,Le Chic Femme,,Jewelry & Watches,macro,TRUE,Title,Default Title,J23,0,shopify,50,continue,manual,269.00,,TRUE,TRUE,https://raw.githubusercontent.com/Jav-12-mtz/le-chic-femme-hydrogen/main/public/images-webp/03_joyas_relojes/J23_Or-Studio-Lumi%C3%A8re.webp,1,Or Studio Lumière,Or Studio Lumière - Le Chic Femme,Gold piece under studio light.,active
j24-chronographe-acier,Chronographe Acier,Steel chronograph. Precision art.,Le Chic Femme,,Jewelry & Watches,"montre, chronographe",TRUE,Title,Default Title,J24,0,shopify,50,continue,manual,1129.00,,TRUE,TRUE,https://raw.githubusercontent.com/Jav-12-mtz/le-chic-femme-hydrogen/main/public/images-webp/03_joyas_relojes/J24_Chronographe-Acier.webp,1,Chronographe Acier,Chronographe Acier - Le Chic Femme,Steel chronograph. Precision art.,active
j25-boucles-goutte,Boucles Goutte,Drop earrings. A single elegant gesture.,Le Chic Femme,,Jewelry & Watches,boucles,TRUE,Title,Default Title,J25,0,shopify,50,continue,manual,179.00,,TRUE,TRUE,https://raw.githubusercontent.com/Jav-12-mtz/le-chic-femme-hydrogen/main/public/images-webp/03_joyas_relojes/J25_Boucles-Goutte.webp,1,Boucles Goutte,Boucles Goutte - Le Chic Femme,Drop earrings. A single elegant gesture.,active
